Device ID,Device Name,Start Time,Transcript,Keywords,Keywords Detected,Similarity,Analytic Thinking,Authenticity,Certainty,Clout,Emotional Tone,Direction,Word Count
140,Danny Pineda,0:03:57,Representative of reality bro. Do it works. So we stop,,,,30,0,0,10,0,-1,10
140,Danny Pineda,0:04:09, Progress last week.,,,,0,0,0,0,33,-1,3
140,Danny Pineda,0:04:15," Okay, so today we'll continue with",,,,29,0,0,14,0,-1,6
140,Danny Pineda,0:04:21, What do so? Then just pick up on what you did last week. So we are looking at the blank platform which obviously is words. We are using now. So the build platform is more like a collaborative supports probability support system.,,,,12,0,0,10,7,-1,42
140,Danny Pineda,0:04:45," That helps to track how people then group, another help, too.",,,,9,0,0,18,9,-1,11
140,Danny Pineda,0:04:52,"Consciousness of people allows you to do with the colored beads. So the idea is, we tend to record the conversation and also try to use video technology to also track husband. They also did a really good job data and try to analyze them. You have to start patterns of our people, give up after options. I will not show on how to collaborate.",,,,14,2,5,11,5,-1,65
140,Danny Pineda,0:05:23," After that we collaborated very happy, don't you improve your learning and also what are the collaborative skills that represent that could help house better collaboration within a group. Okay. So we carried out a survey and we got some feedback from that service. So initially we came up with things too short but his family",,,,21,0,4,11,9,-1,56
140,Danny Pineda,0:05:48,"It in the Collaborative, Learning over will support system as a whole. Like, know why don't we allow the person to serve themselves to tell us what if you do, you want to see?",,,,14,0,0,6,11,-1,34
140,Danny Pineda,0:06:00," Of the Odyssey and the other Canadian adjudge somebody to be into have a good collaboration qualities. It is also some 40. Once you mentioned about want you to believe you peers and of the collaboration exercise, right? Some say they want to see people and information about the progress of their hands on activity or a discussion from the. Don't you see how their discussion? Like it's the topic of topic.",,,,16,0,5,8,8,-1,72
140,Danny Pineda,0:06:30," Crispy, then person who is speaking more on the order and enthralled of inflation of time to speak. So that's one of the things they really felt. The only information about to have them. No integration constant quality.",,,,10,0,0,8,5,-1,38
140,Danny Pineda,0:06:43,"Look what you done with, you can review, does postdoc or real-time HDR recommend Just For Better Learning, practical efficient. So today, where we can, as we have done. So during collaborator activity, you want to see the work. They've done the Progressive Party walk. How does the work integrate in contribute to the final results of collaboration and recovery disk activity, you know?",,,,15,0,2,9,14,-1,64
140,Danny Pineda,0:07:13," So the question we are going to ask you, do you think quality quantity and quality of work done? During a Collaborative Learning needs to be evaluated.",,,,15,0,0,7,7,-1,27
140,Danny Pineda,0:07:31, Utility completely and the quality of work done during the Collaborative Learning me.,,,,15,8,8,8,8,-1,13
140,Danny Pineda,0:07:38,People invented.,,,,0,0,0,0,0,-1,2
140,Danny Pineda,0:07:54, Speaking is you don't need to push anything.,,,,22,0,0,0,0,-1,8
140,Danny Pineda,0:08:29," Discussion. But also on Hands-On activity, like people working",,,,10,0,0,20,10,-1,9
140,Danny Pineda,0:08:33,"That in the coding project, also kind of like, trying to create something below and it will let us all discussion. But also,",,,,13,0,9,17,13,-1,23
140,Danny Pineda,0:08:44," On Hands-On activity here, say they started sort of things so the valuating things done versus things. But what I'm doing. So that's quantity and quality mother orders without them.",,,,15,3,3,12,3,-1,30
140,Danny Pineda,0:09:03, Again.,,,,0,0,0,0,0,-1,1
140,Danny Pineda,0:09:18, Okay. Yeah I was gonna say like I would want to say that quality is more important than quantity is my answer.,,,,9,14,9,9,14,-1,22
140,Danny Pineda,0:09:28," Yeah, I think.",,,,33,33,0,33,0,-1,3
140,Danny Pineda,0:09:29,"Quality of our party, but I feel like what's harder is coming up with a criteria for like what does good quality mean or what does high-quality mean? I feel like that does have to be set by the group beforehand, right? But I guess the way for the platform to do that, I mean, like you said, we won't think about implementation, but I feel like, yeah. The only challenge is like how, how can the platform like assess quality and like a consistent way. But yeah, but I think quality over quantity for sure.",,,,20,6,6,9,16,-1,96
140,Danny Pineda,0:09:59, Sure.,,,,0,0,100,0,0,-1,1
140,Danny Pineda,0:10:00," Yeah. So I think you had them put a question on which our site, right? So what suggestion do you like looking at a programming exercise or any programming exercise. There's also a discussion going on.",,,,8,3,3,11,5,-1,36
140,Danny Pineda,0:10:24,The house on activity this cause you're not done. Like we need to pick communicates we need to. So how do you think about track quality? How did you can assess quality?,,,,27,0,0,9,9,-1,32
140,Danny Pineda,0:10:39, I think it's a very relative thing that depends on what you're saying. I think people people think the discussion should,,,,22,9,4,0,0,-1,21
140,Danny Pineda,0:10:52, come up with that.,,,,50,0,0,0,0,-1,4
140,Danny Pineda,0:11:03, Okay.,,,,0,0,0,100,0,-1,1
140,Danny Pineda,0:11:06, And there are ya.,,,,25,0,0,25,0,-1,4
140,Danny Pineda,0:11:11," It comes back to like the social aspect about like keywords where it's like we're in discussion. And like I say a point and everyone's like, oh,",,,,10,3,7,7,20,-1,27
140,Danny Pineda,0:11:19,"We know it's going to DIA or like, I like that. I do like that. Will signify I guess, like, that statement or that point wasn't it, cause our quality, right? So I feel like, you can't like it kind of ties back to my little cute keyword idea, or keyword topic, that we're having a little speak up because I can listen. And remember, I was able to see. I cannot like that. Yeah.",,,,14,10,3,8,19,-1,75
140,Danny Pineda,0:11:55," puts because books in enjoy another, I think, quantity and account because when there's like more",,,,24,6,6,24,12,-1,16
140,Danny Pineda,0:12:05," There's some individuals that feel less than like, like they don't really want to share their ideas out or they don't feel like, oh, like this is a good enough like ever.",,,,26,0,6,3,20,-1,32
140,Danny Pineda,0:12:15,"So this we'll just agree with that. So I think we should also try to. I don't like I think quantity is also important in terms of measuring the quality looks you're saying Audrey, you're saying quantity for the individual but not necessarily for the group.",,,,18,6,0,10,10,-1,46
140,Danny Pineda,0:12:43," oh,",,,,0,0,0,0,0,-1,1
140,Danny Pineda,0:12:48, all right.,,,,50,0,100,0,50,-1,2
140,Danny Pineda,0:12:52," Thank you for group discussions to measure. Like, if it was a good discussion before the meeting have objectives and see if you reach this whole different levels of objectives. How far did you get with in though, in the discussion? So you hit the first arrived, the second objective, it was",,,,10,0,6,12,10,-1,52
140,Danny Pineda,0:13:10,"Pretty good meeting but we could have done more and then you can look more into that. Like why didn't we reach? If we had our meeting, we didn't reach all for lover, things that we want to talk about, we didn't get there, it may be near the end to somehow be able to sort of measure the tone. I mean discussion before being - you were being positive. I think that could be another aspect of quality for the discussion.",,,,25,2,5,5,8,-1,82
140,Danny Pineda,0:13:38," I think also would be objectives and stuff. I feel like it might be useful for the group to input their objectives and like their goals for the meeting or the work session or whatever like beforehand and then I don't know what people's thoughts on this are but like what's it called? I was thinking of at the end of it, like at the end of the group session or whatever you rank, how far he's everyone Rings. Like, just like quickly scale of one to five. How how much",,,,18,4,1,13,11,-1,91
140,Danny Pineda,0:14:05,"Izzy think we made on this? Maybe, I don't know. I mean some either. I feel like that sounds kind of cumbersome. Like, I don't like, you don't really want to do that after every meeting. But yeah, but open to us about this point. So I think the deliverables in my skills and objective. So what you have,",,,,27,10,5,8,11,-1,59
140,Danny Pineda,0:14:35," that separate then even if we spend time, you know,",,,,30,0,10,20,20,-1,10
140,Danny Pineda,0:14:41," doing one little thing based on the difficulty of that activity, even if you don't do as much because I say yeah, that's good quality because whatever will to achieve Arabic Italian can constitute quality work, done. That makes sense and also I agree with you.",,,,17,4,6,13,13,-1,46
140,Danny Pineda,0:15:00,"Wanted to because you can't measure quality without keep. There's a little structure of quantity if you can. You should expect before you can begin to talk about quality, right? Because if we don't, we can imagine what individually each person is contributing then you're gonna have anything to measure for Quality so the only bit of quality on the information on the Olympus you have. So it's already gives his County includes little different which I think all of you made good.",,,,18,1,3,8,7,-1,83
140,Danny Pineda,0:15:30," Sensei quality is important. And point is also very, very important.",,,,9,0,27,18,27,-1,11
140,Danny Pineda,0:15:58,"And if the individual needs that the team collectively decide Zone, there are also quantity because you've done whatever you said earlier, which is also about setting goals for ourselves. Based on what",,,,15,0,3,15,0,-1,33
140,Danny Pineda,0:16:26," Because but just about finding myself, if I die my soul and we don't have people responsible different after effects that we give us our first. But if we say, OK, we are collaborating, you handle these, you hundred that you do. So that's way longer login window, reset of the system and that is going to make sense, that's good. Thanks for the illusion, that beautiful worlds. Now, the Chinese",,,,19,4,7,11,8,-1,71
140,Danny Pineda,0:16:50, What's constitute good?,,,,0,0,25,0,25,-1,3
140,Danny Pineda,0:16:51,Do my back early bad work done?,,,,0,14,0,0,14,-1,7
140,Danny Pineda,0:17:11, Is there any some internet keypad will do?,,,,25,0,0,0,0,-1,8
140,Danny Pineda,0:17:18, What's the question actually been answered by the quantity and quality?,,,,8,0,0,8,8,-1,11
140,Danny Pineda,0:17:29, Yeah I want to say that like if you measure someone there the quantity and quality of someone's record like that will tell you if a good job or a bad job was done. Yeah.,,,,14,3,6,11,11,-1,35
140,Danny Pineda,0:17:54,"All of you, trust them. So they've covered everything I like but I suggest you come by for a delight. Yeah, 4:30. So how is the measured? I think you've already answered that. Come on, Lobos. Have your answer as we want entitled. That's one question. We end up oxygen or oxygen than I have done because order to come to, how can you measure what you got about? These people give me an idea of having my stones on adjective set.",,,,17,7,2,10,6,-1,82
140,Danny Pineda,0:18:23, So do we need to measure? So I think option is ticked. Okay? Make sense.,,,,40,7,0,13,13,-1,15
140,Danny Pineda,0:18:36," okay, so the next one is",,,,17,0,0,17,0,-1,6
140,Danny Pineda,0:18:49,Yes.,,,,0,0,100,100,0,-1,1
140,Danny Pineda,0:18:51," Okay, so the next one is, how can the result of the",,,,17,0,0,17,0,-1,12
140,Danny Pineda,0:18:56, what measured the presented in order to guarantee objective evaluation,,,,10,0,0,0,30,-1,10
140,Danny Pineda,0:19:07," Yeah, because we are measuring something rights. And then this is the me GD, who measurement, but in his presence of adults, because we are trying to give feedback to the student participant identity, right? And I want to be as objective as possible. You don't want to be biased, we don't be subjective. Want it to be. Want to be to be like, yeah, how did you measure? And that's what the question is.",,,,18,3,3,13,5,-1,75
140,Danny Pineda,0:19:34, How can result be presented?,,,,20,0,0,20,0,-1,5
140,Danny Pineda,0:19:37,"That's just looking at these results. You could, you know, I do to deserve objective measurements of words. Thoughts, you don't feel like, oh, I put it so much. Labor system is going to be. So what are the things we need to put into position? While it is equal to guarantee objective feedback on cue and getting results?",,,,15,3,0,7,11,-1,59
140,Danny Pineda,0:20:07, So you know how much of that is finished?,,,,22,0,0,22,11,-1,9
140,Danny Pineda,0:20:33,Through this box showing the different stages of the work done by each other space and then the group as but not more to participant skills are good for you personally just suppose somebody's building the UI but your hands of these will be database then they could be 1 volt reviewer. I wonder how much it.,,,,18,2,2,12,5,-1,57
140,Danny Pineda,0:21:01," I think you said in the wording and presentation,",,,,22,11,0,11,0,-1,9
140,Danny Pineda,0:21:08," I don't know, maybe it could be.",,,,38,13,0,0,13,-1,7
140,Danny Pineda,0:21:11," In terms of like statistical analysis to, I don't know, too much about that, so yeah.",,,,6,6,0,6,12,-1,16
140,Danny Pineda,0:21:24, My answer would be pretty similar to what's inside me like percentage bar. Is,,,,20,13,0,0,13,-1,14
140,Danny Pineda,0:21:27,"To what you were supposed to be working on or what like you contribute it to, I think that seems Seems good to me.",,,,21,8,4,4,13,-1,24
140,Danny Pineda,0:21:50, what considerations should you should we put in mind to litigate bounces,,,,33,0,0,0,8,-1,12
140,Danny Pineda,0:22:23,"Question please. What design position should we put in mind in order to mitigate bass? Bass is a a, so it was design what practices that consideration.",,,,11,0,0,4,15,-1,27
140,Danny Pineda,0:22:43, I'll try to think of what kind of biases that come up and I'm having some trouble or chicken and then it's trying to bypass the system.,,,,20,7,0,13,3,-1,27
140,Danny Pineda,0:22:58," Solid, I send off that is working, but it's not working. However, all who is actually honestly working. There are putting that would not be so much more so ways people can work to do.",,,,14,3,3,11,0,-1,35
140,Danny Pineda,0:23:16, Because this is not going to using.,,,,43,0,0,14,0,-1,7
140,Danny Pineda,0:23:18,It's severe with. You can also be used really for like you've ever given if a project and it's really about looking at just trying to look at different degrees possible.,,,,24,0,3,9,6,-1,31
140,Danny Pineda,0:23:29," You also get together. We will by myself like killing them. How about a story after being so they don't stop. This is a story about how a person system and even know how someone would bypass the system. I don't even, I can't imagine how somebody would do.",,,,23,6,6,13,8,-1,49
140,Danny Pineda,0:23:56," Yeah, because I think of a better plan. My son has been stated at Lee",,,,13,13,0,7,7,-1,15
140,Danny Pineda,0:24:05," Instead of rewarding, for you can take it.",,,,0,0,0,0,0,-1,8
140,Danny Pineda,0:24:14,"Maybe one way could be like I don't know if you have like your own profile. So every time you login you have your stats or whatever. So they you're doing something, we're differently one thing but that's extreme. So because some days you are going to talk more than like other meetings when we need to do something. That's pretty crazy because you think that's gonna help you up, maybe like to prevent that.",,,,20,1,1,11,9,-1,75
140,Danny Pineda,0:24:44," The number of the level of interference by the commitment, but I think if you just take the mice to emotional episodes, you like eee, they'll approach of that work. That is system, must have determined that you have people bringing in their own point of view or whatever. Yeah, you know I did that we do",,,,16,3,2,5,9,-1,57
140,Danny Pineda,0:25:09,"Introduce the credibility of the system. Yeah, yeah.",,,,0,0,0,25,13,-1,8
140,Danny Pineda,0:25:19," This is the majority like talking the whole play Trucking up to back house. We are discussing now, write the blog platform is just recording Allah Allah stickies where our machine many models that take this raw data and then try to extract the features.",,,,9,0,0,4,7,-1,45
140,Danny Pineda,0:25:38," I didn't start and then begin our install. We're going to touch on the fact patterns in this data. So like you made it as a. Oh, I agree with you, it's very direct, our energies said, from what you said, there's an ugly and also extended your point. And so these are the two that I don't read. The description was actually fruitful because there are other arguments and you reached a lot of competitions.",,,,12,4,4,12,2,-1,76
140,Danny Pineda,0:26:06,My voice in the nuts. So then it's easy to cheat the system because if I have mine,,,,11,16,5,21,5,-1,18
140,Danny Pineda,0:26:14, Program music.,,,,0,0,0,0,0,-1,2
140,Danny Pineda,0:26:17," So it'll be like, video components so that's can also record.",,,,15,0,0,23,8,-1,11
140,Danny Pineda,0:26:39," Okay, so let's go to underrated. This might be on the weighted just right now. Displayed on the register Rush. Yeah, for now. Okay. So we should",,,,14,0,7,11,7,-1,27
140,Danny Pineda,0:26:56, I think that's true.,,,,40,20,20,0,20,-1,4
140,Danny Pineda,0:26:59,"Hopefully, it'll take you. You can actually activate Spanish for a languages politicians of transplantable from that loyalty to",,,,5,0,0,0,5,-1,19
140,Danny Pineda,0:27:10," Let's go to Penn State's so time Spanx. Yeah. So do you consider pain spreads on a Collaborative, Learning activity and infertility for good curvature, ecology.",,,,7,0,7,11,7,-1,26
140,Danny Pineda,0:27:29, Okay.,,,,0,0,0,100,0,-1,1
140,Danny Pineda,0:28:32,"Okay, thanks.",,,,0,0,0,50,0,-1,2
140,Danny Pineda,0:28:36," For the Love of most of the world, like, the world, see boys, that want to see how much time it spends activity, you know, more than we spent discussing how much time you spend",,,,17,0,0,6,9,-1,35
140,Danny Pineda,0:28:50,"yeah, we had a lot of those responses, so",,,,22,0,0,11,0,-1,9
140,Danny Pineda,0:28:53," I've been does that put the whole thing? But I forgot because, now, you're more looking. People? Just fill out, surveys to sometimes. Just the scenery is just like a more into specks your models for your morning. Yeah. Okay.",,,,19,5,0,5,12,-1,40
140,Danny Pineda,0:29:13, it's a lot of pressure that is,,,,13,0,0,0,0,-1,7
140,Danny Pineda,0:29:18, what if we assume I was a sufficient for a June is not necessary. So how do you think time can be measured? Let us as a developer regardless of whatever period is officially made it. But how do you think is going to look like transition?,,,,21,2,4,13,4,-1,47
140,Danny Pineda,0:29:39," figure with the keywords like that, we've been talking about, like, you record the time that the",,,,11,0,0,0,11,-1,17
140,Danny Pineda,0:29:45,"First introduced and then you, you like it. I think you would plot how often it was like use during a certain time period. And then like you just measure from when it started to like when it was like significantly talked about and then what it like the last time that keyword showed up.",,,,16,2,4,16,13,-1,55
140,Danny Pineda,0:30:14," But I don't think it's like it's not as simple as like the first time the last time because like when you're in conversation you just so you can hop around a lot. So I think you know, it's important to look at like the frequency of the keyword and like record what the moments that it was like really frequent. It was really yeah, I've got enough",,,,16,4,3,11,12,-1,68
140,Danny Pineda,0:30:41,"Strictly deciding what to learn, what's not thinking, what most times is what you put into shock. If you are in control circuit shock, if you are with a topic of discussion or they are out of here, same circle is 2 plus 2.",,,,23,0,0,9,2,-1,44
140,Danny Pineda,0:31:36,"You lock up frequently during the discussion and there is easy. That's correct. You know. Yes, we have real tough it out.",,,,22,0,13,4,17,-1,22
140,Danny Pineda,0:31:47," So again points like goes wrong, which obviously is a keyword and then you guys are to travel time.",,,,5,0,0,16,11,-1,19
140,Danny Pineda,0:31:59," We should also be systematic, keep track of the different times. So how how long do they speaking? Because if we started, I spoke to his work in his kitchen. So the photos are from the law firm. I spy my speech a tells me how much time I spend speaking and if, by any discussion, maybe you spoke the velocities February, 22 journals, he spent it going",,,,21,7,0,15,1,-1,68
140,Danny Pineda,0:32:28," Number of times, I asked you, what happened?",,,,0,13,0,0,0,-1,8
140,Danny Pineda,0:32:31,"Birds kids, is that?",,,,0,0,0,0,0,-1,4
140,Danny Pineda,0:32:37," Yes, Mother, the product you are present is teaching all the time spent on also help us to also limited quality of recording / again, and you're making scientific contributions positive evidence. You are putting in love enough time and they make purchases by because they learned of contribution up how your contributions in will generally cost in that direction.",,,,13,0,7,10,10,-1,60
140,Danny Pineda,0:33:06, Because I think we're and Son activities. Like time should be measured like security for each individual is because some for some people like they might get distracted or easily or they might have so many medical restrictions. That doesn't certainly like allows them to focus.,,,,27,2,0,13,10,-1,46
140,Danny Pineda,0:33:27,"Well, we're to get a divot. He's our projects done as fast as other people do. So you shouldn't be comparing like, how long it takes for a person to complete one day. Mac necessarily have different restrictions",,,,10,0,2,10,10,-1,38
140,Danny Pineda,0:33:43, Yes.,,,,0,0,100,100,0,-1,1
140,Danny Pineda,0:33:49, Let's go.,,,,0,0,33,0,0,-1,2
140,Danny Pineda,0:33:53, What kind of activity do link or visual learning?,,,,11,0,0,11,11,-1,9
140,Danny Pineda,0:34:03, Okay.,,,,0,0,0,100,0,-1,1
140,Danny Pineda,0:34:05," We know that time Springs, right? Is subjective. But are there any particular activity?",,,,29,0,14,7,21,-1,14
140,Danny Pineda,0:34:14," That will feel time should be like, the time-space should become such a huge measured.",,,,25,0,0,0,6,-1,15
140,Danny Pineda,0:34:23,"In particular, that particular activity, that's if you don't need any time, spent in missing some key tonight.",,,,20,0,10,5,10,-1,18
140,Danny Pineda,0:34:50, So what types of activities we should take time earlier? You should measure time. Yeah.,,,,20,0,0,7,0,-1,15
140,Danny Pineda,0:35:01," Feel like writing code is a big one. Yeah. Like somebody working on like one bug and then they're only able to, like, show like three comments for that bug. When they've actually spent like a long time, working on that really like, somebody did it turned a lot of time, but",,,,11,0,0,7,15,-1,52
140,Danny Pineda,0:35:17,"It a lot or seemingly a lot of codes. I was also thinking about, like maybe finding a way for the system, like to compare, like the ratio, someone's like time spent look like the quality that that task like delivered. Like, I don't know because like, if you're doing a task that has like like alert low priority, or you have a test that like you did that wasn't super high quality and then you look at the time spent on that. I feel like that can tell us",,,,11,3,0,7,17,-1,90
140,Danny Pineda,0:35:48," Yeah, but I don't know.",,,,33,17,0,17,17,-1,5
140,Danny Pineda,0:35:57, A ques.,,,,0,0,0,0,0,-1,2
140,Danny Pineda,0:35:58, He's on something.,,,,0,0,0,0,0,-1,3
140,Danny Pineda,0:36:02," I think times when shall be measured because we are looking at is the output of the was actually trying to get little things more. Like, there's like that. What you're giving him",,,,9,3,0,6,6,-1,33
140,Danny Pineda,0:36:12,"Giving out is I'll tell you what your ticket. So thanks for coming. We hope this pain relief original argument throughout the good and then you spend more time trying to do that. I'm thinking that should also be a good place for you because you miss your t-shirts, commitment and dedication. Now, we'll just spend a little time. Do we need to meet Camp suggest on seriously, like, you're not passionate only? Does that make sense?",,,,17,2,2,7,15,-1,77
140,Danny Pineda,0:36:46, I don't know if you solve the problem in less time. I'm not gonna stop until then I'm looking at Lenny. It was trying to solve a problem.,,,,19,10,0,10,3,-1,28
140,Danny Pineda,0:37:02," like,",,,,0,0,0,0,100,-1,1
140,Danny Pineda,0:37:08,"Including everyone has a different experience. Level is very soon as long as they're doing whatever they should be, the time didn't really matter.",,,,8,0,8,8,8,-1,24
140,Danny Pineda,0:37:25, How you tell?,,,,33,0,0,33,0,-1,3
140,Danny Pineda,0:37:29," That the editor of doing what I'm doing. What? What is, what are you doing to do? So, how much of that does?",,,,4,4,0,8,0,-1,23
140,Danny Pineda,0:37:42," Suppose what somebody in this group has the task of making like a scroll bar work, have you made that work and it doesn't matter if you've taken ten minutes for you to do wrong things. But have you done what he is supposed to be?",,,,15,0,2,6,4,-1,46
140,Danny Pineda,0:37:58, Did your courage because I don't even only came as deadlines that we can.,,,,20,7,7,13,13,-1,14
140,Danny Pineda,0:38:04,Ulan.,,,,0,0,0,0,0,-1,1
