Device ID,Device Name,Start Time,Transcript,Keywords,Keywords Detected,Similarity,Analytic Thinking,Authenticity,Certainty,Clout,Emotional Tone,Direction,Word Count
142,Audrey Benitez,0:39:14,So that it's fair and everyone's doing the work.,,,,9,0,0,18,9,-1,9
142,Audrey Benitez,0:39:19," Very nice house. Look like making sure people are engaged, so they know it's what's happening. What's so people know what's happening? They're engaged. And it also give like and sound like how like if some of the certain folks are like not participating as much like things that we can do like to change our group dynamic to encourage that people who don't speak as much to feel comfortable saying there cause we're just sharing their personal.",,,,16,0,5,11,19,-1,78
143,Tochukwu,0:01:41,"No, I'm just so what? No BL Inc.",,,,11,11,0,11,11,-1,8
143,Tochukwu,0:01:52," So, I don't want any.",,,,33,17,0,17,0,-1,5
143,Tochukwu,0:02:36,Are you okay?,,,,0,0,0,33,0,-1,3
143,Tochukwu,0:02:45, Yeah.,,,,0,0,0,100,0,-1,1
143,Tochukwu,0:02:56, Multiplayer.,,,,0,0,0,0,0,-1,1
143,Tochukwu,0:02:59, Unfortunately.,,,,0,0,0,0,0,-1,1
143,Tochukwu,0:03:35,I'm going to take care of it.,,,,0,13,0,0,13,-1,7
143,Tochukwu,0:03:55, It's representative. So we stopped at,,,,29,0,0,14,0,-1,6
143,Tochukwu,0:04:08, progress last week.,,,,0,0,0,0,33,-1,3
143,Tochukwu,0:04:15," Okay, so today we'll continue with",,,,29,0,0,14,0,-1,6
143,Tochukwu,0:04:20," Wait won't do. So, let me just give it a quick recap on.",,,,14,7,14,7,14,-1,13
143,Tochukwu,0:04:27,"What you did last week. So we are little nuts. The blink platform, which obviously is what",,,,6,0,0,6,0,-1,17
143,Tochukwu,0:04:35," You are using now. So the build platform is more like the collaborative, support Collaborative Learning support system, that helps to track how people learn as it is as a group. Another helped to create a consciousness of people that was improved with the collaborate. So the idea is, we tend to record, you know, conversations and also try to in a use video technology to",,,,12,0,0,11,11,-1,66
143,Tochukwu,0:05:05, Also track and Hands-On activities. And I also then I really do. We get a data and try to analyze them. Not to extract patterns of how people behavioral patterns actions and inactions on how people collaborate and,,,,26,5,0,26,3,-1,38
143,Tochukwu,0:05:22,"Actually, the Collaborative Learning is helping them to improve your learning. And also what are the collaborative skills that they possess that could help? You know it has better collaboration within a group. Okay. So we carried out this survey and we got some feedback from that survey. So initially we came up with things, we felt what is about needed in a Collaborative, Learning environment, support system as a word. Like, no, why don't?",,,,21,0,0,8,9,-1,75
143,Tochukwu,0:05:52," Treat. Allow the person themselves to tell us what they feel. They want to see of the want to see and the other the Canadian McGeorge. Something to be a good collaboration quality in. This is also something that's a no, I want you to mention about don't do to review peers and end of the collaboration exercise, right? Some say they want to see proof.",,,,13,1,4,4,10,-1,66
143,Tochukwu,0:06:17,"Which anybody progress of the islands of activity on a discussion, something, you want to see how their discussion in no progress has like, is it's within the topic, is it off topic? A people speed then person who is speaking more than the other and then people are getting fair share of time to speak. So some of the things they raised, that's the only information about to help them know in the collaboration, has good quality, or look what you done with the can review that postdoc or real-time and see how they can adjust.",,,,12,0,2,9,12,-1,97
143,Tochukwu,0:06:48," For Better Learning and better collaboration. So, today we are looking at work done. So during collaboration activity, we want to see the",,,,17,0,0,13,17,-1,23
143,Tochukwu,0:06:58," Work, they've done the progressive, are they work? How do they work in cricket? You know, contribute to the final results of the collaboration and collaborative activity, you know?",,,,13,0,0,7,17,-1,29
143,Tochukwu,0:07:13,"So the question we are going to ask is, do you think quality quantity and quality of work done? During the Collaborative Learning needs to be evaluated?",,,,15,0,0,7,7,-1,27
143,Tochukwu,0:07:30," YouTube, the quantity and the quality of work done. During the Collaborative Learning needs to be evaluated.",,,,12,0,0,6,6,-1,17
143,Tochukwu,0:07:52, But no speaking is you don't need to put anything like that. Again is just like,,,,24,0,0,6,18,-1,16
143,Tochukwu,0:08:10,so if you like the content Discovery should be given the quality of visible just to make sure that people actually,,,,19,0,5,10,24,-1,21
143,Tochukwu,0:08:22," okay, our team is what we look at is not just discussion but also on Hands-On activity like people working together in the coding project or it will kind of like trying to create something, you know and so many of some discussion but also on",,,,19,0,0,15,13,-1,46
143,Tochukwu,0:08:43," On Hands-On activity, you're saying things to try and instead of things it's what evaluating things done versus thing said. But both of them, both of them together. So those quantity and quality matter or does either of them",,,,19,0,2,12,5,-1,39
143,Tochukwu,0:09:02, I guess.,,,,50,50,0,0,0,-1,2
143,Tochukwu,0:09:04,"An administrative judge has like two people coding. One person can be like, 15, get comments. The other person's working on something. So how do you assess him, Scott? Okay, yeah. I was going to say like I would want to say that quality is more important than quantity is my answer.",,,,6,6,4,4,10,-1,52
143,Tochukwu,0:09:27," Yeah, I think quality of our boy but I feel like what's harder is coming up with a criteria for. Like what does good quality mean or what does high quality me? And I feel like that does have to be set by the group beforehand, right? But I guess a way for the platform to do that. I mean, like you said, we won't think about implementation, but I feel like, yeah. The only challenges like how, how can a platform like assess quality and like a consistent way. But yeah, but I think quality over quantity.",,,,21,8,4,10,16,-1,98
143,Tochukwu,0:09:57, City for sure.,,,,0,0,33,0,0,-1,3
143,Tochukwu,0:09:59,"Yeah so I think you read in fact a question I'm going to answer it. That's why you're here. Yeah. How does how does the system Plus on assess quality? So what suggestion do you think, like lighting like looking at a programming exercise or it? Because even in a programming exercise, there is also a discussion going on. So even in the context of a Hands-On activity this cause you're not done like we needed to think communicate to be.",,,,15,2,3,10,8,-1,81
143,Tochukwu,0:10:29, You too. So how do you think we could try quality? How did you can access quality?,,,,29,0,0,18,12,-1,17
143,Tochukwu,0:10:39, I think it's a very relative thing that depends on your life like you're saying. I think people the people who make the discussion should,,,,19,7,4,0,7,-1,25
143,Tochukwu,0:10:51, come up with that.,,,,50,0,0,0,0,-1,4
143,Tochukwu,0:10:55,Okay.,,,,0,0,0,100,0,-1,1
143,Tochukwu,0:11:02, Okay.,,,,0,0,0,100,0,-1,1
143,Tochukwu,0:11:05, And there are ya.,,,,25,0,0,25,0,-1,4
143,Tochukwu,0:11:12," Special keywords and everyone's like, oh, that was good idea. I like that idea will signify against like that.",,,,15,5,5,5,30,-1,19
143,Tochukwu,0:11:51,"To be for each individual in the group. Or is it just some general books? Look at these books, individual, another group quantity and account, because there's like, more people in that group, there's some individuals that feel blessed act, like they don't really want to share their ideas out or they don't feel like this is a good agree with that. So I think we should also try to",,,,26,1,3,8,8,-1,70
143,Tochukwu,0:12:19," To like I think quantity is also important because of measuring. The quality is not sure about their ideas. Yeah, you were saying Audrey. You're saying quantity for the individual but not necessarily for the group.",,,,16,3,3,8,11,-1,36
143,Tochukwu,0:12:45,Measure the quality of each individual.,,,,17,0,0,0,17,-1,6
143,Tochukwu,0:12:51," Save it for group discussions to measure. Like, it was a good discussion before the meeting have objectives and see if you reach so different levels of objectives, how far did you get with, in do in the discussion? So you hit the president, the second objective. It was a pretty good meeting, we could have done more. Hmm. And then you can look more into that. Like why didn't we reached the end of our meeting? We did reach out for lover. Thanks everyone.",,,,16,0,3,8,10,-1,85
143,Tochukwu,0:13:22, Maybe in Union to somehow be able to sort of measure the tone of a discussion before being negative will be positive. I think another aspect of quality for discussion. I think also with the objectives and stuff. I feel like it,,,,19,7,2,5,10,-1,42
143,Tochukwu,0:13:40,Be useful for the group to input their objectives and like their goals for the meeting or the work session or whatever beforehand. And then I don't know what people's thoughts on this are but like what's it called? I was thinking of,,,,15,4,0,13,9,-1,43
143,Tochukwu,0:13:54," At the end of it, like at the end of the group session or whatever you rank, how far is everyone ready to like, just like quickly scale of one to five? How, how much progress do you think we made on this? Maybe, I don't know. I mean to me that I feel like that sounds kind of cumbersome like, like you don't really want to do that after every meeting. But, but up until this point,",,,,21,5,5,9,13,-1,78
143,Tochukwu,0:14:32," My stones and objective, we have that stated.",,,,25,13,0,13,13,-1,8
143,Tochukwu,0:14:35,"And even if we spending a lot of time, you know, doing one little thin based on the difficulty of that activity. Even if we don't do as much, we can also say yes good quality because whatever we to achieve our opponent and can constitute quality work done. That makes sense and also agree with you, which quantity because you can't measure quality with that. Keep, there's a little bit",,,,26,0,7,14,12,-1,71
143,Tochukwu,0:15:05," Pressure of quantity. If you can, you should expect before you can begin to talk about quality, right? Because if we don't even imagine what individually each person is contributing, then we're gonna have anything to measure for Quality. So you want a bit of quality on the information on the on the inputs you have so if I were to give his County includes if I'm just going to be. So I think all of you made a good sense of quality is important.",,,,19,3,6,10,13,-1,85
143,Tochukwu,0:15:31,"And point is also very, very important.",,,,14,0,43,29,14,-1,7
143,Tochukwu,0:15:42," Huge difference and enforce your own garden stuff and everybody has different things. So we're setting goals. And if the individual needs their, that the team collectively resides on also quantity because you've done whatever you said that you would, which is also what we're doing it to wear.",,,,17,0,0,15,0,-1,49
143,Tochukwu,0:16:12," Setting goals for ourselves based on what we can. And if we achieve those that seen as a quantity,",,,,26,0,0,16,5,-1,19
143,Tochukwu,0:16:25, Because they're just about it.,,,,33,0,0,17,17,-1,5
143,Tochukwu,0:16:26,"My stool, like it, if I did my student we don't have people responsible for different aspect of it later became possible for us to but if we say OK, we are collaborating, you handle this, you handled that you do. So that way, when we are logged in, you know, very set up the system and that was kinda makes sense. That's good. Yeah, thanks for the contribution. That beautiful was now, our question is,",,,,17,4,4,8,8,-1,76
143,Tochukwu,0:16:49, What constituted good work done or it back or bad work done.,,,,17,0,8,17,17,-1,12
143,Tochukwu,0:17:10, Is there any some internet bad work done?,,,,25,0,0,0,0,-1,8
143,Tochukwu,0:17:17, Why is equation actually been answered by the quantity and quality.,,,,18,0,0,9,9,-1,11
143,Tochukwu,0:17:29,Yeah I want to say that like if you measure someone there the quantity and quality of someone's work ethic that will tell you a good job or a bad job was done. Yeah. Yeah.,,,,11,3,6,8,8,-1,35
143,Tochukwu,0:17:52, So the mission is to be fast and everything before you guys say goodbye. So I think,,,,12,6,6,18,6,-1,17
143,Tochukwu,0:18:17,"We'll give an idea of having my stools an objective set. So Darwin easy to measure so I think option is ticked. Okay, makes sense.",,,,23,8,8,8,15,-1,25
143,Tochukwu,0:18:36," okay, so the next one is",,,,17,0,0,17,0,-1,6
143,Tochukwu,0:18:48, Yes.,,,,0,0,100,100,0,-1,1
143,Tochukwu,0:18:50," Okay, so the next one is, how can the result of the",,,,17,0,0,17,0,-1,12
143,Tochukwu,0:18:55, of what is measured represented in order to guarantee objective evaluation,,,,9,0,0,0,27,-1,11
143,Tochukwu,0:19:07," Yeah, because we are measuring something, right? And then the system is Junior who measurement.",,,,20,0,7,20,7,-1,15
143,Tochukwu,0:19:12,acting is present in such a way that,,,,0,0,0,0,0,-1,8
143,Tochukwu,0:19:15," because we are trying to give feedback to the to the participants at the end of the day, right? And I want to be as objective as possible. We don't want to buy us, we don't be subjective. Wanted to be wanted to be to be like it. Yeah. What did you measure them? And let's do. The question is, how can the results will be presented?",,,,16,1,4,9,7,-1,67
143,Tochukwu,0:19:36," So, you're not just looking at the results, you could, you know, I do to do this an objective measurement of what went to science. You don't feel like, oh, I could do so much more, but the system is not. Give me. So, what are the things that we need to put into conceptual system? To guarantee objective feedback out - that's presentation?",,,,18,5,2,6,11,-1,64
143,Tochukwu,0:20:06," So, you know how much?",,,,40,0,0,40,20,-1,5
143,Tochukwu,0:20:08,In Spanish. So instead of,,,,20,0,0,20,0,-1,5
143,Tochukwu,0:20:11," Saying that somebody finish something you can say that this task is completed so much. So it doesn't need to be targeted. And they also know, if you see a bunch of tasks and how much their computer then everybody knows what's assigned to them already.",,,,17,0,2,17,2,-1,46
143,Tochukwu,0:20:27," So that could be one. Okay? So like multi, we are like to ba progress bars showing the different stages of the work done by each participant's and then the group as a whole, but not not of the participant that could change personal just of suppose, somebody's believe in you are, okay, that's obvious. If they could be one part of the UI, okay?",,,,21,0,1,10,6,-1,65
143,Tochukwu,0:21:03,Sudden the wording and I'll presentation.,,,,14,14,0,14,0,-1,6
143,Tochukwu,0:21:07," I don't know, maybe it could be.",,,,38,13,0,0,13,-1,7
143,Tochukwu,0:21:11," In terms of like statistical analysis to but I don't know too much about that. Yeah, yeah.",,,,11,6,0,11,11,-1,17
143,Tochukwu,0:21:23, Answer me pretty similar to what's been said you like percentage bars related to what you were supposed to be working on or what you contributed to. I think that seems to get to me. I've been thinking,,,,13,10,0,3,5,-1,38
143,Tochukwu,0:21:43," All right, that's cool. The last one is",,,,11,0,22,11,11,-1,8
143,Tochukwu,0:21:49, what design consideration should you should we put in mind to mitigate bath?,,,,31,0,0,0,15,-1,13
143,Tochukwu,0:22:04,Yes. Do you have an idea of any kind of athletic committee? I think I should touch. The defense attorney asked for this,,,,17,9,4,4,13,-1,23
143,Tochukwu,0:22:24, Is what design consideration? Should we put in mind in order to mitigate bass masses design consideration?,,,,18,0,0,0,24,-1,17
143,Tochukwu,0:22:43, I'm trying to think of what kind of glasses will come up during work done.,,,,13,6,0,0,6,-1,15
143,Tochukwu,0:22:48," A soda or treating, and it worked out.",,,,38,0,0,25,0,-1,8
143,Tochukwu,0:22:54,And then it's trying to bypass the system.,,,,11,0,0,22,0,-1,8
143,Tochukwu,0:22:58," so you got some gloves, guys, walking because it's not working, you know, I never thought who is actually honestly working, we are putting our own is not doing so much work so you have any idea of waste people come and want to be you know,",,,,29,2,2,10,4,-1,47
143,Tochukwu,0:23:15," Because this system can be using different scenarios. You can also be used really for like you are given a project and it's really about looking at just trying to look at the same two Grady's possible, Right? Do I say, okay, I think I have a way of bypassing like story after the",,,,18,5,5,5,7,-1,54
143,Tochukwu,0:23:49,Can't imagine somebody will be okay.,,,,0,0,0,14,0,-1,6
143,Tochukwu,0:23:55," yeah, because I think on the part of the plan, the myosin has been stated accurately and again,",,,,17,6,0,11,0,-1,18
143,Tochukwu,0:24:03," Okay. So I mean, technically, if you knew what the algorithms and stuff we're looking for, you can take advantage of that.",,,,22,4,4,13,4,-1,22
143,Tochukwu,0:24:12," I don't know, okay, maybe one way could be like, I don't know if you like your old profile, so everything login at your stats or whatever. So maybe you're doing something, we're differently. When they both like extreme because some days you are going to talk more than like other public meetings when they need something.",,,,20,3,2,11,10,-1,57
143,Tochukwu,0:24:44,"The level of interference by participants you can make impute. But I think you can just take the mice too emotional opportunity, like key in the progress of the work that is system automatically determine dots from the bank so that you have people bringing in their own point of view or what if you did. Well, you know, under that way that would reduce the credibility of the system allow",,,,13,1,3,6,13,-1,71
143,Tochukwu,0:25:19," The system is just like shocking the hoop like tracking the active like us. We are discussing now, right? The blink platform is just recording. Our Allah speeches. We have machine learning models that take this raw data and then try to extract some features",,,,13,0,2,4,13,-1,45
143,Tochukwu,0:25:37, and then starts and then begin to understand me.,,,,33,11,0,44,11,-1,9
143,Tochukwu,0:25:40,"Try to understand patterns in this data. So, like humidity as a, no, I agree with you. That's what is a direct. Our energies saying from what you said, there's an ugly and also extended your point and so these are the things I regret. But I would look out for. I don't reduce all the discussion was actually fruitful because they were a lot of arguments and we reach a lot of competitions.",,,,17,5,3,12,4,-1,74
143,Tochukwu,0:26:07, Minutes.,,,,0,0,0,0,0,-1,1
143,Tochukwu,0:26:38,"Okay, so let's go to unrelated, this might be unrelated but does right now this blank only registered English. Yes, I'm not. Okay, so we should look outside. Yeah, well, I think that shouldn't be because with the machine learning model, we have can actually pick you. You can actually activate Spanish or along with this. All you need to do is transfer contrasting from table with two.",,,,23,3,6,7,3,-1,68
143,Tochukwu,0:27:06," To to English. So let's go to time spans, so time. Spain's. Yeah. So do you consider times parents only Collaborative Learning activity and important metric for good collaboration quality.",,,,9,0,6,13,16,-1,30
143,Tochukwu,0:27:28, Okay.,,,,0,0,0,100,0,-1,1
143,Tochukwu,0:27:32,It depends on what is compensatory in other things with maybe like five minutes could still come up with a really good plan more time spent afternoons were terms of like zone out and check your email and like whatever else is going on here.,,,,22,0,2,4,9,-1,45
143,Tochukwu,0:28:29,"okay, so time spoons is not",,,,17,0,0,17,0,-1,6
143,Tochukwu,0:28:35," Hopefully, not most of these look like they want to see why I don't see how much time do you spend activity? You know, my time is spent discussing. You know, how much time is spent? Yeah, we had a lot of those responses, so I didn't deserve what happened with anybody, for God's will, because now you're more looking. People just fill out, surveys to sometimes, just fill it up and I'm just curious what I want. I'm in this kind of",,,,22,7,0,6,11,-1,83
143,Tochukwu,0:29:03," Glare more introspect. You're more thoughtful more energy. Yeah, okay.",,,,0,0,0,18,9,-1,10
143,Tochukwu,0:29:11, This is keeping all other a question and that is okay. We assumed I was asking a question so we assume is not,,,,22,4,4,9,0,-1,23
143,Tochukwu,0:29:22,"So, how do you think I'm coming measure? Let us answer the other questions, regardless, of whatever opinion is about, if it should be made, but how do you think this community affect times?",,,,31,3,3,14,3,-1,34
143,Tochukwu,0:29:39," With the keywords like that, we've been talking about like, you record the time that the keyboard is first introduced. And then you, you like it, I think you would plot how often it was like use during a certain time period. And then like you just measure from when it started to like when it was like significantly talked about and that was the last time that he would show up.",,,,16,1,3,11,11,-1,72
143,Tochukwu,0:30:02, Hi.,,,,0,0,0,0,0,-1,1
143,Tochukwu,0:30:13," but I don't think it's like, it's not as simple as the first time the last",,,,16,5,5,16,5,-1,16
143,Tochukwu,0:30:17,Like when your conversation you just so you can hop around a lot. So I think it's important to look at like the frequency of the keyword and like record what the moments that it was like really frequent. Those really strictly deciding what considering rings for than what's not in terms of condensation.,,,,16,2,0,7,11,-1,54
143,Tochukwu,0:30:47," I think keyword most times is what you put into shock. If people are in on track to track, if you are within a topic of discussion or they are out of, you know, seeing secondly is to also try that understanding. So if we we've had a particular class which is about 25 maybe about how to use iPhone and then we do some keyword, we can put this comes out to one last question.",,,,25,1,1,12,3,-1,76
143,Tochukwu,0:31:12,"Understanding and in the frequency of the amount, not the number of keywords different keyword and it's because of how you measure things can tell us your decree but how you're not suit those Concepts. So now another day of of keyword those are fucking topic modeling which will cars and then decides working on. Yeah. So it's talking about it. I would love for me so topic which we feel you know, should discuss our mission field should rule your call frequently during discussion. And then if we see that according we know, yes we are within topic.",,,,21,2,1,14,6,-1,99
143,Tochukwu,0:31:42," Oh yeah. So that's mostly what's keyword help us to to do? Yeah. So I identify points like because when we mention is keyword in your discussion, you have a list of keyword and then we can use that to travel time, you know, Spence.",,,,15,2,0,13,9,-1,45
143,Tochukwu,0:31:58," Yeah, we didn't ya. These are also the systemic keep track of the different time you speak literally so we have how",,,,17,0,0,13,0,-1,22
143,Tochukwu,0:32:07,"Longview a speaking. Because if we started, I spoke, he spoke, you know, we keep speaking. So, difficult of not for myself, I might speak appears tells me how much time I spend speaking, and if, by the end of discussion, maybe you spoke with the last one is probably 20 minutes into the social. Means he spent in control above time, I your active starting again with time spent, is that",,,,25,8,1,8,1,-1,72
143,Tochukwu,0:32:36," Yes, not just the fact that you are present on your speaking. Also, thanks Belle. Can also help us to also measure the quality of the continued agenda that you're there and you're making tangible contributions. Also, tell her that you were putting enough enough time and they've been impactful by looking at the number of contribution and out how your contributions in Tripoli calls.",,,,13,0,6,12,6,-1,65
143,Tochukwu,0:33:04,I think that is the direction of the whole conversation.,,,,10,10,0,0,0,-1,10
143,Tochukwu,0:33:09," And Son activities like time should be measured like separately. For each individual is because some for some people like they might get distracted more easily, or they might have some medical restrictions. That doesn't certainly allows them to focus. Well, these are projects done as fast as other people do. We shouldn't be comparing how long it takes for a person to complete.",,,,20,0,2,9,8,-1,64
143,Tochukwu,0:33:53, What kind of activity do?,,,,0,0,0,0,20,-1,5
143,Tochukwu,0:33:58,Hmm.,,,,0,0,0,0,0,-1,1
143,Tochukwu,0:34:03, Okay.,,,,0,0,0,100,0,-1,1
143,Tochukwu,0:34:04," We know that X Planes right is subjective. What I dare, any particular activity that will fill time. Should be like the times when should be constitutional measure.",,,,18,4,7,4,21,-1,28
143,Tochukwu,0:34:22," Is there any particular? Any particular activity? That's if you don't have any time spent, you may be missing some you know, Keaton. Are you gonna jump?",,,,24,0,7,3,10,-1,27
143,Tochukwu,0:34:53,Relationship.,,,,0,0,0,0,0,-1,1
143,Tochukwu,0:35:00," Big writing code is a big one. Yeah. Like somebody working on like one bug and then they're only able to, like, show, like three commit to that bug when they've actually spent like a long time, working on that was like, somebody didn't spend a lot of time, but committed a lot, or seemingly a lot of food.",,,,13,0,2,8,11,-1,59
143,Tochukwu,0:35:20," I was also thinking about, like,",,,,0,17,0,17,17,-1,6
