Device ID,Device Name,Start Time,Transcript,Keywords,Keywords Detected,Similarity,Analytic Thinking,Authenticity,Certainty,Clout,Emotional Tone,Direction,Word Count
144,Lucas,0:52:45, If you wanted to visualize it you could put it in like some sort of radar charts. Like show your strengths and weaknesses and it's okay if you have a weakness,,,,25,0,0,13,6,-1,31
144,Lucas,0:52:55, Yeah.,,,,0,0,0,100,0,-1,1
144,Lucas,0:53:07," Then again, didn't get a chance. What I want.",,,,20,10,0,10,0,-1,9
144,Lucas,0:53:22,"You have metrics of what you're presenting. Yeah. I mean I don't really know the metrics are but the types could be like want to be eye contact. One could be like, so I'm like visualization shows the level of each eye contact not. Yeah.",,,,19,6,2,4,19,-1,45
144,Lucas,0:54:16,"Pleasure to meet you. I feel like I'm kind of skeptical of like telling your participant, like, what the criteria is. I hope they're getting greater than 0, because I really like if I know, like, when I know they just got to look at you or like, if I know what I need to do to pass like, I feel like my initial thought would be like,",,,,22,14,0,7,26,-1,68
144,Lucas,0:54:43," algorithm, we",,,,50,0,0,0,0,-1,2
144,Lucas,0:55:11,A way that they can show their participation that the algorithm. Correct. I think you're right.,,,,6,6,6,0,12,-1,16
144,Lucas,0:56:02, I didn't say anything. I just think.,,,,38,25,13,0,13,-1,7
144,Lucas,0:56:06,"Be discouraging, and I feel like maybe instead of that if you have like a graph or something off, like when your participation was the most, hmm, then you can see that. This is when your participation was the highest for somebody who's always participating. It'll be like relatively high all the time. And they could also wonder why it wasn't so high in the beginning and the ending. We could figure it out themselves.",,,,21,1,3,13,6,-1,75
144,Lucas,0:56:31," But discussion if I get like a 2-1 participation as we know why. Why am I even doing this discussion? I said, what I had to write it.",,,,26,15,4,11,11,-1,28
144,Lucas,0:57:26,Oh good.,,,,0,0,50,0,50,-1,2
144,Lucas,0:57:29, I wasn't I wasn't even really have the greatest student.,,,,8,17,8,0,8,-1,10
144,Lucas,0:58:01,I'm lost.,,,,0,33,0,0,0,-1,2
144,Lucas,0:58:48," If you feel satisfied with yourself, you're able to put in something.",,,,23,0,0,8,8,-1,12
144,Lucas,0:59:29,they literally so much in the measure these,,,,13,0,0,13,0,-1,8
144,Lucas,0:59:42, also feels,,,,50,0,0,50,0,-1,2
144,Lucas,0:59:57,Why does that part?,,,,25,0,0,0,0,-1,4
144,Lucas,1:00:49,It's coming something that I need to express.,,,,11,11,0,0,0,-1,8
144,Lucas,1:01:38,"Races are total Boys in my showing the cancer, like, other to satisfied with the progress that the whole group hasn't so far, but then it's also like, someone's tone of voice can also be race, just because that's who they are. Like, I know, eat them. Does that seem not to call you? He's not necessarily like it's me. Yeah.",,,,13,4,1,9,13,-1,61
144,Lucas,1:02:09, It's hard though. That's the only.,,,,0,0,0,13,0,-1,6
144,Lucas,1:02:25," because like,",,,,50,0,0,50,50,-1,2
144,Lucas,1:02:36,"It is one of that which are going through, which we forget about functions, which I believe is probably cannot. Even when we belief able to track it.",,,,14,4,4,4,7,-1,28
144,Lucas,1:02:54, We have interviews that we have total everything you do.,,,,30,0,10,0,0,-1,10
144,Lucas,1:02:58, Can.,,,,0,0,0,0,0,-1,1
144,Lucas,1:03:00," Play on their psyche, because Emily conflict.",,,,14,0,0,14,0,-1,7
144,Lucas,1:03:06, Another element being my sister has all become fit and it's another. Then we're going to tell the conference,,,,19,5,5,10,5,-1,19
144,Lucas,1:03:29,"You should see yourself a inspiring or not. Yeah yeah, yeah, and at least what we do that means there's no just some like you're skinny like yourself and then just repeat what you find. So why am I why you keep eating Fritos.",,,,28,2,2,11,9,-1,44
144,Lucas,1:03:51, Cool. This is really insightful and wonderful concerned. I'm happy to have you guys. It's love. So let me tell you guys what I can.,,,,7,11,4,7,11,-1,25
145,Ethan,0:01:56,Who's hope who's hope?,,,,33,0,0,0,33,-1,4
145,Ethan,0:02:10, As Danny.,,,,50,0,0,50,0,-1,2
145,Ethan,0:02:31," You got the admin, login?",,,,0,0,0,0,0,-1,5
145,Ethan,0:02:35," Yeah, let me log in real quick.",,,,14,14,29,14,14,-1,7
145,Ethan,0:02:57,Where's our mini remote aircraft?,,,,0,0,0,0,0,-1,5
145,Ethan,0:03:05," Hey, their asses but what are you doing?",,,,13,0,0,13,0,-1,8
145,Ethan,0:03:16, I'm working on it. It's like 90%. I have nothing. They're just sort of like I don't got nothing.,,,,9,14,0,0,14,-1,19
145,Ethan,0:03:45,"My dreaming. Yeah, then I'm lucky. I like",,,,11,33,0,11,22,-1,8
145,Ethan,0:03:51, Gerard and I work.,,,,25,25,0,25,0,-1,4
145,Ethan,0:03:53, There were only so right.,,,,20,0,20,20,20,-1,5
145,Ethan,0:04:08, Can I see?,,,,0,33,0,0,0,-1,3
145,Ethan,0:04:14," So,",,,,100,0,0,100,0,-1,1
145,Ethan,0:04:40,Sports.,,,,0,0,0,0,0,-1,1
145,Ethan,0:05:35,So good. We've got some feedback initially.,,,,25,0,13,13,13,-1,7
145,Ethan,0:07:29,The polity of Wonder blaming her ability when we sleep.,,,,20,0,0,10,20,-1,10
145,Ethan,0:07:46, I have to push this to sleep or before.,,,,11,11,0,11,0,-1,9
145,Ethan,0:07:54," I think quality more than 40 because a lot of people can hijack, it just to make sure that people actually contribute.",,,,24,5,5,5,19,-1,22
145,Ethan,0:08:25,"Discussion but also on Hands-On activity, like people working together in the future.",,,,7,0,0,14,7,-1,13
145,Ethan,0:08:48, Books.,,,,0,0,0,0,0,-1,1
145,Ethan,0:09:03," There's like two people coding, one person can me like 50, get comments for the other person's working on something hardly. So how do you assess his contemporary more?",,,,7,3,0,7,7,-1,29
145,Ethan,0:09:17,I would want to say the quality is more important than quantity of plants.,,,,14,7,7,0,14,-1,14
145,Ethan,0:09:23," Yeah, I think quality required but I feel like what's harder is coming up with the criteria. Fairly what does going to college? I feel like that. Does somebody said running through be more and right, well I guess I'll a fridge form to do that but I feel like yeah, only challenges.",,,,18,11,2,5,11,-1,53
145,Ethan,0:10:14,"There's also a discussion, so Community activity, exposure from the gateway to. So, how do you think?",,,,11,0,0,22,6,-1,17
145,Ethan,0:11:04," I guess. I think it comes back to like, our",,,,20,20,0,0,20,-1,10
145,Ethan,0:11:07,"Last week about like keywords where it's like webbing in discussion and like I say a point and everyone's like, oh, like that was a good idea or like, I like that. I do like that. Will signify, I guess, like, that statement or not point was like of higher quality, right? As I feel like again, like, it kind of ties back to like, the whole cute keyword idea, or keyword topic that were having a last week.",,,,12,6,6,7,25,-1,79
145,Ethan,0:12:02,"They don't want to share their ideas out or do you feel like, oh, this is a good enough. Like you've already sent his. We'll just agree with that. So I think we should also try to like I think quantity is also important in terms of measuring the quality of the discussion because not every individual is that I feel",,,,25,5,3,8,13,-1,61
145,Ethan,0:12:23, To share out there ideas.,,,,40,0,0,0,20,-1,5
145,Ethan,0:12:30," Quantity for individual, my quantity.",,,,0,20,0,0,0,-1,5
145,Ethan,0:12:58,"The other expression. So interested in particular that good, it was a pretty good meeting.",,,,7,0,20,7,33,-1,15
145,Ethan,0:13:54,"this quickly see how much privacy that you made on this, to me that I feel like that sometimes",,,,21,11,0,5,11,-1,19
145,Ethan,0:14:48,"Quality more than mixes. I couldn't eat it's completely because you can't measure quality without to get under the pressure of competition. You can't respect before. You can we talk about quality, right? Because if you don't,",,,,14,2,2,7,12,-1,37
145,Ethan,0:15:40, and everybody knows different things.,,,,40,0,0,20,0,-1,5
145,Ethan,0:15:44,"With setting goals, I feel like you need to divide those goals into individual tasks and if the individual needs their goal that the team, collectively decide Zone then I hear our guys also quantity because you've done whatever he said that he needed to do which is also what we're doing until we're setting goals for ourselves. Based on what we did we can do and if we achieve those that seen as a quantitatively good amount of work,",,,,20,2,2,12,4,-1,80
145,Ethan,0:16:41,What's considered a good worker?,,,,17,0,17,0,17,-1,5
145,Ethan,0:17:02, Tell me something.,,,,0,33,0,0,0,-1,3
145,Ethan,0:17:49,This is goodbye.,,,,0,0,0,0,33,-1,3
145,Ethan,0:18:36,Wow.,,,,0,0,0,0,0,-1,1
145,Ethan,0:18:42, So how can we look up?,,,,33,0,0,33,0,-1,6
145,Ethan,0:18:47," What measure represented, irritability objective evaluation.",,,,0,0,0,0,17,-1,6
145,Ethan,0:18:56, How can I be presented?,,,,20,20,0,20,0,-1,5
145,Ethan,0:19:25,Refurbished.,,,,0,0,0,0,0,-1,1
145,Ethan,0:19:27," so, you're not just within our results, you could actually measure",,,,25,0,0,8,8,-1,11
145,Ethan,0:19:57," So, you know, how much our systems. So instead of saying that somebody turning something, you can say that this stuff has been given so much, so it doesn't even feel targeted. And we also know, if you see a bunch of tasks and how much their community and everybody knows what the time to do, so,",,,,19,0,3,21,7,-1,57
145,Ethan,0:20:23,"This box should increase the use of the local package, just do something.",,,,23,0,0,0,8,-1,13
145,Ethan,0:21:18,You were supposed to be working on.,,,,14,0,0,0,0,-1,7
145,Ethan,0:21:39, What type of solution?,,,,0,0,0,0,25,-1,4
145,Ethan,0:22:10,"Can you repeat the question, please?",,,,0,0,0,0,17,-1,6
145,Ethan,0:22:21, Design principles. It was design one.,,,,0,0,0,0,0,-1,6
145,Ethan,0:23:06,Difference to be able to go free for that. You're going to give it because it and it's really hot.,,,,14,0,5,9,14,-1,20
145,Ethan,0:24:02,"Maybe one way to be like that your own profiles, everything, whatever. So we're doing something we're differently when they go to such extreme but some days you're going to talk more than likely",,,,14,0,3,8,3,-1,34
145,Ethan,0:24:56,"Reduce. This is the major fucking go back to that house real Plus for me, just because we have machine learning models exist and then try to extract the pictures.",,,,20,3,3,13,13,-1,30
145,Ethan,0:25:26, I don't like you.,,,,0,20,0,0,20,-1,4
145,Ethan,0:25:53,"My voice from yours inverse. Yeah. So then it's easy to cheat the system because if I have my phone, that's recording. Let me sleep in and see someone else is talking. So it'll be like, I'm contributing to with me.",,,,9,13,4,13,4,-1,41
145,Ethan,0:26:59,"So, thank you.",,,,67,0,0,33,33,-1,3
145,Ethan,0:27:25," We'll come up with a plan. Yeah, Marcus I often lose works.",,,,31,8,0,8,0,-1,12
145,Ethan,0:28:40,What about you think that people to know your Mo? You just feel surveys to sometimes just,,,,35,0,0,0,18,-1,17
145,Ethan,0:28:55, Okay.,,,,0,0,0,100,0,-1,1
145,Ethan,0:29:01," These assume. So, how do you think I can immediately understand what?",,,,25,8,0,17,8,-1,12
145,Ethan,0:29:17, How do you do?,,,,25,0,0,25,0,-1,4
145,Ethan,0:29:33,"You give, I think you would plot how often it was like used during certain time period. And then like",,,,30,5,10,15,15,-1,20
145,Ethan,0:29:40, Use as much as you want to start it tonight.,,,,20,0,0,20,0,-1,10
145,Ethan,0:30:19," Deciding what useful for maybe something in what's Now, isn't? That like strictly deciding what specific things?",,,,5,0,0,0,11,-1,17
145,Ethan,0:30:28,"words, not in terms of colonization collaboration, EP work, most of the album we have",,,,20,0,0,0,7,-1,15
145,Ethan,0:31:23,"if you see that,",,,,25,0,0,25,0,-1,4
145,Ethan,0:31:51, How long?,,,,50,0,0,50,0,-1,2
145,Ethan,0:32:20,"Yes, the motors product, you are presently speaking. All the answers, also help us to be recorded because the Constitution",,,,10,0,10,10,5,-1,20
145,Ethan,0:32:59, Because we get some for some people like they might get distracted more easily or they might have something like medical restrictions. That doesn't certainly like allows them to focus well or you get activities or projects on as fast as other,,,,21,0,0,14,9,-1,42
145,Ethan,0:33:14,So you should be comparing like how long it takes for a person to complete this other person when they met necessary.,,,,14,0,9,14,9,-1,22
145,Ethan,0:33:25, The issues.,,,,0,0,0,0,0,-1,2
145,Ethan,0:33:36, What kind of?,,,,0,0,0,0,33,-1,3
145,Ethan,0:33:57," A few and should be very persuasive, because it should be measured.",,,,33,0,8,17,8,-1,12
145,Ethan,0:34:10,Missing some key Latino.,,,,25,0,0,0,0,-1,4
145,Ethan,0:34:33, So like what types of activities we should take time earlier issue? Emotional time for me.,,,,19,6,0,6,6,-1,16
145,Ethan,0:35:06,"Maybe a little late assistant, like, to compare like being ratios. Someone's, it finds met with like the quality that that task, like delivered. Like, I'm gonna fizzle, like, if you're doing a task that has, like a low priority, or you have excessive heat that wasn't super high-quality and easy.",,,,9,2,2,5,21,-1,51
145,Ethan,0:36:00,"This is giving more than is very very to learn how to do good. And then you several times,",,,,11,0,16,16,11,-1,19
145,Ethan,0:36:55,"As long as they're doing whatever. Be the time, didn't you?",,,,15,0,0,15,0,-1,11
145,Ethan,0:37:25," Somebody in this group has a task of making, like a scroll bar work, having made that way, and it doesn't matter if you've taken ten relationship or two hours. What have you done? What you were supposed to do?",,,,14,0,2,7,5,-1,40
145,Ethan,0:37:40, Because I do.,,,,33,33,0,33,0,-1,3
145,Ethan,0:37:51,"Operation of help worksheet because believe I have are not have to do any ice in life. A lot of company that he worked at, they have a nice out him but they give you a task and at the end of the day you just have to finish that asking. If you finish it you have to end up staying for nine hours and you're just wasting a lot of time, please.",,,,18,1,1,7,9,-1,73
145,Ethan,0:38:52,What?,,,,0,0,0,0,0,-1,1
145,Ethan,0:38:55," But everyone's like doing a beautiful job, so that is fair and everyone's doing the world.",,,,11,0,0,17,11,-1,16
145,Ethan,0:39:15," Like if some of the certain folks are like, not participating as much, like things that we can do like to change our group, dynamic to encourage that people who don't speak as much to feel comfortable saying, your thoughts were just sharing their thoughts and what not.",,,,22,0,2,8,16,-1,48
145,Ethan,0:39:35," If you guys had the same thing, yeah.",,,,25,0,0,13,0,-1,8
145,Ethan,0:40:34,Yes. Hi.,,,,0,0,50,50,0,-1,2
145,Ethan,0:40:36,Acting.,,,,0,0,0,0,0,-1,1
145,Ethan,0:41:03," How often people speak. But also with that active participation, I feel like you can",,,,33,7,0,20,7,-1,15
145,Ethan,0:41:15," Measure like the quality of illicit or like how like, well that time the constantly engage in the conversation, that goes that actually like furthering their people gain anything.",,,,10,0,0,7,28,-1,29
145,Ethan,0:41:42,Nothing like looking for keywords like I agree or I disagree because it's okay to have both of those because that's how you learn among each other and you are to respect others ideas and perspectives on the project.,,,,22,5,0,15,10,-1,39
145,Ethan,0:41:56," I guess for me, I'm kind of confused. Like, what do you mean by like in active participation?",,,,11,16,5,0,16,-1,18
145,Ethan,0:42:27,Does this mean that I'm stupid? We just leave that. I'm not interested. So which is something us. It's because they're like by the mission. We could tell. What is the system? Who is that is? So how does that matter?,,,,18,4,4,9,9,-1,41
145,Ethan,0:43:26,"Complication, so do not mix of contribution and participation here and contributing not us.",,,,29,0,0,21,7,-1,14
145,Ethan,0:44:18,"In this ceremony, they weren't paying attention. So it's hard to say. Yeah, there's also people who take notes so they don't really like. Yeah. And you know there's some people who like as you can try to do this now but some people who actually like don't really do I contact as much while I'm talking about. Sometimes there's",,,,12,3,1,12,7,-1,60
145,Ethan,0:44:45," There's some people who like to really use as much. I contact like sometimes, like, staring off into like, God knows where but you're still listening.",,,,25,4,0,7,18,-1,26
145,Ethan,0:45:14,I did get attention once again icon? Yes. Now if we are talking about,,,,14,7,14,7,0,-1,14
145,Ethan,0:46:11,"Any more fun, blue purple, if you have it.",,,,22,0,0,11,11,-1,9
145,Ethan,0:46:18, Hmm.,,,,0,0,0,0,0,-1,1
145,Ethan,0:46:59, It's too. Like I've confined people just doing this a lot when they're,,,,13,6,0,6,13,-1,13
145,Ethan,0:47:04,"Actively listening and agreeing but not necessarily can also consider like facial expressions. Like for me personally like sometimes when I do talk to people like yeah I don't make eye contact with them when I when I'm trying to think of like how I want to like make a point. Like I'm sorry like moving my hands or like I look up like I'm sorry. I go like this, you know like stuff like that. I think is ways you can track it, perhaps.",,,,17,13,1,9,22,-1,85
145,Ethan,0:47:59,"maybe able to like, say something about a subject, a lot of people that like I make eye contact",,,,16,5,5,0,32,-1,19
145,Ethan,0:48:54,"Among the few months in Pete's, incoming data analysis.",,,,0,0,0,0,0,-1,9
145,Ethan,0:49:51,"And modules. So yeah, if these things don't come naturally to me I'll be making an effort to do it. Good reason. Yeah, I said is a bunch of like many if there if it's all or or aware then it makes them",,,,22,7,4,17,7,-1,43
145,Ethan,0:50:46,That's right. I can't believe. Yeah.,,,,13,13,13,13,13,-1,6
145,Ethan,0:51:40,Brazil.,,,,0,0,0,0,0,-1,1
145,Ethan,0:51:44, This is the way that you are.,,,,0,0,0,0,0,-1,7
145,Ethan,0:52:40,Chuck's what will be compared to what I did? He,,,,0,9,0,0,0,-1,10
145,Ethan,0:53:10, Sure.,,,,0,0,100,0,0,-1,1
145,Ethan,0:53:13, I don't know.,,,,25,25,0,0,25,-1,3
145,Ethan,0:54:26,"My initial thought is doing that right side, General statements, but like I think you also might be useful and part of me feels like, participants shouldn't know, but then the other part, like I feel like it could be useful in solving them ways that they can show their participation that we honor the paramedics. Thank you, Roy Woods.",,,,21,7,2,8,16,-1,60
145,Ethan,0:55:21,The level maybe to fight that fight globalization activity.,,,,11,0,0,0,0,-1,9
145,Ethan,0:55:33, I didn't say anything. I did.,,,,14,29,14,0,0,-1,6
145,Ethan,0:56:01, Yeah.,,,,0,0,0,100,0,-1,1
145,Ethan,0:57:12,"So, these sites that made me proud decision. I'm also proud",,,,8,17,0,17,17,-1,11
145,Ethan,0:58:13,"I think so just because usually when you make good progress or you'll get good enough effort, if you're satisfied with yourself, you're able to put in something.",,,,26,3,10,16,19,-1,28
145,Ethan,0:59:05,Populism.,,,,0,0,0,0,0,-1,1
145,Ethan,0:59:12, Honestly.,,,,0,0,0,0,0,-1,1
145,Ethan,1:00:19,I've adjusted.,,,,0,33,0,0,0,-1,2
145,Ethan,1:00:53,"What I measured. You're not giving it to me. I can think of but this is for areas like drink or projects. Like if someone can still start swearing or races or tone of voice in my showing the kids have like other to satisfied with the progress of the whole group has not so far but then it's also like someone's to. My boys can also be racist because that's who they are. Like, I know Ethan is that so",,,,14,7,1,14,8,-1,81
145,Ethan,1:01:23," Sometimes, it's not to call you.",,,,29,0,0,0,14,-1,6
145,Ethan,1:01:54,Because the like constructs of collaboration is your reach.,,,,11,0,0,11,22,-1,9
145,Ethan,1:02:49,"So, like identities, where you should see yourself.",,,,13,0,0,13,13,-1,8
148,yamini2,0:03:57,Presentable.,,,,0,0,0,0,0,-1,1
148,yamini2,0:04:05," So,",,,,100,0,0,100,0,-1,1
148,yamini2,0:04:15," Okay, so today will continue.",,,,20,0,0,20,0,-1,5
148,yamini2,0:04:22," so, when you're using, I have to try",,,,11,11,0,22,0,-1,8
148,yamini2,0:04:52,"Consciousness, if you don't listen to beautiful. So the idea is we thank you because composition and educated",,,,26,0,0,21,11,-1,18
148,yamini2,0:05:18, Action.,,,,0,0,0,0,0,-1,1
148,yamini2,0:05:42," So, it shall be.",,,,25,0,0,25,0,-1,4
148,yamini2,0:05:53,"And now, because it's absurd to tell us. What if you we want to see.",,,,31,0,0,19,0,-1,15
148,yamini2,0:06:00, Of the undersea and the other comedian. A job somebody to be happy.,,,,8,0,0,8,8,-1,13
148,yamini2,0:06:09, Yes.,,,,0,0,100,100,0,-1,1
148,yamini2,0:06:44,"If you don't is actually kind of just the family. So today, when we can have more. So during prohibition, you want to see the",,,,15,0,0,15,8,-1,25
148,yamini2,0:06:58, Work in progress about how does it work computer contributing final results. Do you think quality quantity and quality of work done during equality? Very nice.,,,,12,0,4,8,19,-1,26
148,yamini2,0:07:30, You didn't put any quality of Wonder being equal ability. Let me sleep.,,,,14,7,7,0,21,-1,13
148,yamini2,0:07:49,Do I have to push this to speak of the Four Seasons?,,,,0,8,0,0,0,-1,12
148,yamini2,0:07:57," I think quality more than quantity because a lot of people can hijack a group discussion and say a lot of things, but then it doesn't give the space for everybody to talk. So if you like the content that's coming out, should be given more of a priority, maybe quality a little bit just to make sure that people actually do contribute.",,,,18,2,5,9,12,-1,63
148,yamini2,0:08:34,content for other kind of like trying to create something special but also of,,,,7,0,0,14,36,-1,14
148,yamini2,0:08:43," Well, some seafood, you're saying things time. Instead of things said, it's not evaluating things, done versus things that whoops,",,,,14,0,0,0,5,-1,20
148,yamini2,0:09:03, Yeah. But I think it can also be hard to judge because like two people coding one person can make like 50 get comments while the other person is working on something harder. So how do you assess who's contributing more?,,,,12,2,0,15,7,-1,41
148,yamini2,0:09:29,"Like what's harder is coming up with a criteria for? Like what does good quality? I feel like that does have to be set when grouping or in right but it's a way for the form to do that. He said that he won't think about implementation but I feel like yeah, the only challenges like how, how can a platform like assess quality of a consistent way. But yeah, the thing quality over quantity for sure.",,,,13,3,4,9,15,-1,77
148,yamini2,0:09:59, Yes.,,,,0,0,100,100,0,-1,1
148,yamini2,0:10:25,Because you're not doing anything. I'm giving you two. So how many things,,,,27,7,0,20,0,-1,13
148,yamini2,0:10:38," But they consider a relative thing that depends on ya like what you're saying, I think people who people who make the discussion should come up with that.",,,,28,3,0,3,10,-1,28
148,yamini2,0:11:09, And yes I else comes back to like our discussion last week about like key words were it's like whenever in discussion and like I say a point and everyone's like oh like that was a good idea.,,,,10,5,10,10,20,-1,38
148,yamini2,0:11:20,"Like, I like that. I do like. That will signify. It goes like that statement or not point was like of higher quality, right? So, I feel like again, like a kind of ties back to like, still cute keyword idea or keyboards operating room. Having",,,,11,7,4,7,30,-1,46
148,yamini2,0:12:16,"So I think we should also try to like, I think, what is also important in terms of measuring the quality is not, every individual is going to feel comfortable to share out their ideas.",,,,26,6,3,9,14,-1,35
148,yamini2,0:12:38, Not necessary.,,,,50,0,50,0,0,-1,2
148,yamini2,0:12:51," Discussions to measure like discussion before the meeting have objectives and see you reach. So different levels of objectives,",,,,5,0,0,11,5,-1,19
148,yamini2,0:13:14,And then you can look more into that. Like why did we reach our meeting?,,,,27,0,0,13,7,-1,15
148,yamini2,0:13:25," Somehow being able to sort of measure the tone please, especially for being a, if you would be positive.",,,,21,0,11,5,16,-1,19
148,yamini2,0:13:39, I feel like it might be useful.,,,,29,14,0,0,29,-1,7
148,yamini2,0:14:06,It's a realistic feel it that some cumbersome don't really want to do that after every meeting with welcome to us.,,,,26,0,4,0,9,-1,21
148,yamini2,0:15:02,"Once the traditional aspects before you have beautiful quality, right? Because if you don't need them,",,,,18,0,12,12,18,-1,16
148,yamini2,0:15:17, Then.,,,,0,0,0,100,0,-1,1
148,yamini2,0:15:33," But I feel like quantity. It's a little more subjective because the last project that I worked on it was with a bunch of different experience levels are phds and there were like, first year, undergraduate stuff, and everybody knows different things. So with setting goals, I feel like you need to divide those goals into individual tasks.",,,,19,5,2,8,7,-1,58
148,yamini2,0:15:56,"and if the individual needs their goal, that the team collectively decides on then I feel like that is also quantity because you've done whatever you said that you would do, which is also what we're doing, it till we're setting goals for ourselves based on what we think we can do and if we achieve those, that seen as a quantitatively good amount of work,",,,,22,1,1,14,4,-1,66
148,yamini2,0:17:09,Is there any some interactive option?,,,,50,0,0,0,0,-1,6
148,yamini2,0:17:16, Georgia.,,,,0,0,0,0,0,-1,1
148,yamini2,0:17:31, The quantity and quality.,,,,25,0,0,25,25,-1,4
148,yamini2,0:18:00,So how can this be?,,,,20,0,0,40,0,-1,5
148,yamini2,0:18:35, Sorry.,,,,0,0,0,0,0,-1,1
148,yamini2,0:18:44,"um,",,,,0,0,0,0,0,-1,1
